{
  "id": "qa.arith.tsd-relative-speed.gen-0228261cc6",
  "microTopicIds": [
    "qa.arith.tsd-relative-speed"
  ],
  "section": "QA",
  "format": "tita",
  "stemMarkdown": "Two cars start at the same time from two points 194 km apart and travel towards each other at 54 km/h and 20 km/h respectively. After how many hours will they meet? (2 decimal places.)",
  "options": null,
  "correctKey": null,
  "correctValue": 2.62,
  "titaTolerance": 0.02,
  "difficulty": "easy",
  "eloRating": 1000.0,
  "solutionMarkdown": "Relative speed (approaching) $= 54 + 20 = 74$ km/h. Time to meet $= \\dfrac{\\text{distance}}{\\text{relative speed}} = \\dfrac{194}{74} = 2.62$ hours.",
  "altSolutionMarkdown": null,
  "targetSeconds": 110,
  "source": "generated",
  "sourceRef": null,
  "verification": {
    "method": "sympy_verified",
    "verifiedAt": "2026-08-09T00:00:00Z",
    "selfConsistencyAgreement": null,
    "distractorAuditPassed": null,
    "dedupChecked": null,
    "reviewerNote": null
  },
  "tags": [
    "arith:tsd",
    "relative-speed"
  ]
}
