{
  "id": "qa.numsys.base-systems.gen-0c983d47df",
  "microTopicIds": [
    "qa.numsys.base-systems"
  ],
  "section": "QA",
  "format": "tita",
  "stemMarkdown": "Convert 492 (base 10) to base 5.",
  "options": null,
  "correctKey": null,
  "correctValue": "3432",
  "titaTolerance": 0.0,
  "difficulty": "medium",
  "eloRating": 1200.0,
  "solutionMarkdown": "Repeatedly divide 492 by 5 and read the remainders bottom-to-top: $(492)_{10} = (3432)_{5}$.",
  "altSolutionMarkdown": null,
  "targetSeconds": 100,
  "source": "generated",
  "sourceRef": null,
  "verification": {
    "method": "sympy_verified",
    "verifiedAt": "2026-08-09T00:00:00Z",
    "selfConsistencyAgreement": null,
    "distractorAuditPassed": null,
    "dedupChecked": null,
    "reviewerNote": null
  },
  "tags": [
    "numsys:base-conversion"
  ]
}
