{
  "id": "qa.arith.time-work-pipes-cisterns.gen-5ca829bcc5",
  "microTopicIds": [
    "qa.arith.time-work-pipes-cisterns"
  ],
  "section": "QA",
  "format": "tita",
  "stemMarkdown": "Pipe A can fill a cistern in 15 hours and pipe B can fill it in 19 hours. If both pipes are opened together, how long will they take to fill the cistern? (2 decimal places, in hours.)",
  "options": null,
  "correctKey": null,
  "correctValue": 8.38,
  "titaTolerance": 0.02,
  "difficulty": "medium",
  "eloRating": 1200.0,
  "solutionMarkdown": "A's rate $= 1/15$ of the cistern per hour, B's rate $= 1/19$. Combined rate $= 1/15 + 1/19 = 0.1193$ per hour. Time together $= \\dfrac{1}{1/15+1/19} = 8.38$ hours.",
  "altSolutionMarkdown": null,
  "targetSeconds": 100,
  "source": "generated",
  "sourceRef": null,
  "verification": {
    "method": "sympy_verified",
    "verifiedAt": "2026-08-09T00:00:00Z",
    "selfConsistencyAgreement": null,
    "distractorAuditPassed": null,
    "dedupChecked": null,
    "reviewerNote": null
  },
  "tags": [
    "arith:time-work",
    "pipes-cisterns"
  ]
}
