{
  "id": "qa.algebra.progressions.gen-dfbf5cd3d8",
  "microTopicIds": [
    "qa.algebra.progressions"
  ],
  "section": "QA",
  "format": "tita",
  "stemMarkdown": "Find the sum of the first 26 terms of an arithmetic progression whose first term is 1 and common difference is 2.",
  "options": null,
  "correctKey": null,
  "correctValue": 676.0,
  "titaTolerance": 0.0,
  "difficulty": "very_hard",
  "eloRating": 1600.0,
  "solutionMarkdown": "$S_n = \\dfrac{n}{2}\\left[2a + (n-1)d\\right] = \\dfrac{26}{2}\\left[2(1) + (26-1)(2)\\right] = 676$.",
  "altSolutionMarkdown": null,
  "targetSeconds": 100,
  "source": "generated",
  "sourceRef": null,
  "verification": {
    "method": "sympy_verified",
    "verifiedAt": "2026-08-09T00:00:00Z",
    "selfConsistencyAgreement": null,
    "distractorAuditPassed": null,
    "dedupChecked": null,
    "reviewerNote": null
  },
  "tags": [
    "algebra:progressions",
    "ap"
  ]
}
