{
  "id": "qa.arith.time-work-chain-rule.gen-2e48735f36",
  "microTopicIds": [
    "qa.arith.time-work-chain-rule"
  ],
  "section": "QA",
  "format": "tita",
  "stemMarkdown": "23 workers, each working 10 hours a day, can complete a job in 18 days. How many days will 10 workers, each working 8 hours a day, take to complete the same job? (2 decimal places.)",
  "options": null,
  "correctKey": null,
  "correctValue": 51.75,
  "titaTolerance": 0.02,
  "difficulty": "easy",
  "eloRating": 1000.0,
  "solutionMarkdown": "Total work $= 23 \\times 18 \\times 10$ worker-hours $= 4140$. With 10 workers at 8 hours/day, days needed $= \\dfrac{4140}{10\\times8} = 51.75$.",
  "altSolutionMarkdown": null,
  "targetSeconds": 90,
  "source": "generated",
  "sourceRef": null,
  "verification": {
    "method": "sympy_verified",
    "verifiedAt": "2026-08-09T00:00:00Z",
    "selfConsistencyAgreement": null,
    "distractorAuditPassed": null,
    "dedupChecked": null,
    "reviewerNote": null
  },
  "tags": [
    "arith:time-work",
    "chain-rule"
  ]
}
