{
  "id": "qa.arith.mixtures-alligation.gen-d7d33df126",
  "microTopicIds": [
    "qa.arith.mixtures-alligation"
  ],
  "section": "QA",
  "format": "tita",
  "stemMarkdown": "In what ratio must a solution containing 40% acid be mixed with a solution containing 86% acid to obtain a mixture that is 51% acid? Give the ratio (cheaper : dearer) in simplest form, e.g. '3:2'.",
  "options": null,
  "correctKey": null,
  "correctValue": "35:11",
  "titaTolerance": 0.0,
  "difficulty": "hard",
  "eloRating": 1400.0,
  "solutionMarkdown": "By alligation: $\\dfrac{\\text{cheaper}}{\\text{dearer}} = \\dfrac{y - z}{z - x} = \\dfrac{86 - 51}{51 - 40} = \\dfrac{35}{11} = 35:11$ (after simplifying by dividing both terms by 1).",
  "altSolutionMarkdown": null,
  "targetSeconds": 110,
  "source": "generated",
  "sourceRef": null,
  "verification": {
    "method": "sympy_verified",
    "verifiedAt": "2026-08-09T00:00:00Z",
    "selfConsistencyAgreement": null,
    "distractorAuditPassed": null,
    "dedupChecked": null,
    "reviewerNote": null
  },
  "tags": [
    "arith:alligation"
  ]
}
