{
  "id": "qa.modern.permutations-combinations.gen-8762a696a0",
  "microTopicIds": [
    "qa.modern.permutations-combinations"
  ],
  "section": "QA",
  "format": "tita",
  "stemMarkdown": "In how many ways can a committee of 3 people be chosen from a group of 8 people?",
  "options": null,
  "correctKey": null,
  "correctValue": 56.0,
  "titaTolerance": 0.0,
  "difficulty": "easy",
  "eloRating": 1000.0,
  "solutionMarkdown": "This is a selection (order doesn't matter): $\\binom{8}{3} = \\dfrac{8!}{3!(8-3)!} = 56$.",
  "altSolutionMarkdown": null,
  "targetSeconds": 110,
  "source": "generated",
  "sourceRef": null,
  "verification": {
    "method": "sympy_verified",
    "verifiedAt": "2026-08-09T00:00:00Z",
    "selfConsistencyAgreement": null,
    "distractorAuditPassed": null,
    "dedupChecked": null,
    "reviewerNote": null
  },
  "tags": [
    "modern:combinations"
  ]
}
