{
  "id": "qa.numsys.factors-count-sum-product.gen-d08ea5af27",
  "microTopicIds": [
    "qa.numsys.factors-count-sum-product"
  ],
  "section": "QA",
  "format": "tita",
  "stemMarkdown": "Find the sum of all factors (divisors) of 18.",
  "options": null,
  "correctKey": null,
  "correctValue": 39.0,
  "titaTolerance": 0.0,
  "difficulty": "medium",
  "eloRating": 1200.0,
  "solutionMarkdown": "$18 = 3^{2} \\times 2^{1}$. Sum of factors $= (3^{0} + 3^{1} + 3^{2})(2^{0} + 2^{1}) = 39$.",
  "altSolutionMarkdown": null,
  "targetSeconds": 100,
  "source": "generated",
  "sourceRef": null,
  "verification": {
    "method": "sympy_verified",
    "verifiedAt": "2026-08-09T00:00:00Z",
    "selfConsistencyAgreement": null,
    "distractorAuditPassed": null,
    "dedupChecked": null,
    "reviewerNote": null
  },
  "tags": [
    "numsys:sum-of-factors"
  ]
}
