{
  "id": "qa.algebra.polynomials-remainder-factor.gen-11a6b83da6",
  "microTopicIds": [
    "qa.algebra.polynomials-remainder-factor"
  ],
  "section": "QA",
  "format": "tita",
  "stemMarkdown": "Find the remainder when $p(x) = 1x^3 - 7x^2 + 8x + 1$ is divided by $(x - 4)$.",
  "options": null,
  "correctKey": null,
  "correctValue": -15.0,
  "titaTolerance": 0.0,
  "difficulty": "medium",
  "eloRating": 1200.0,
  "solutionMarkdown": "By the Remainder Theorem, the remainder equals $p(4)$: $p(4) = 1(4)^3 - 7(4)^2 + 8(4) + 1 = -15$.",
  "altSolutionMarkdown": null,
  "targetSeconds": 120,
  "source": "generated",
  "sourceRef": null,
  "verification": {
    "method": "sympy_verified",
    "verifiedAt": "2026-08-09T00:00:00Z",
    "selfConsistencyAgreement": null,
    "distractorAuditPassed": null,
    "dedupChecked": null,
    "reviewerNote": null
  },
  "tags": [
    "algebra:remainder-theorem"
  ]
}
