{
  "id": "qa.geometry.triangles.gen-e23aa2e39e",
  "microTopicIds": [
    "qa.geometry.triangles"
  ],
  "section": "QA",
  "format": "tita",
  "stemMarkdown": "A right-angled triangle has legs of length 15 cm and 36 cm. Find its area in cm\u00b2.",
  "options": null,
  "correctKey": null,
  "correctValue": 270.0,
  "titaTolerance": 0.05,
  "difficulty": "hard",
  "eloRating": 1400.0,
  "solutionMarkdown": "For a right triangle, the two legs act as base and height: Area $= \\dfrac{1}{2} \\times 15 \\times 36 = 270.00$ cm\u00b2. (The hypotenuse works out to $39$ cm, a Pythagorean triple.)",
  "altSolutionMarkdown": null,
  "targetSeconds": 110,
  "source": "generated",
  "sourceRef": null,
  "verification": {
    "method": "sympy_verified",
    "verifiedAt": "2026-08-09T00:00:00Z",
    "selfConsistencyAgreement": null,
    "distractorAuditPassed": null,
    "dedupChecked": null,
    "reviewerNote": null
  },
  "tags": [
    "geometry:triangles",
    "right-triangle"
  ]
}
