{
  "id": "qa.algebra.functions.gen-16c7d3ecb8",
  "microTopicIds": [
    "qa.algebra.functions"
  ],
  "section": "QA",
  "format": "tita",
  "stemMarkdown": "If $f(x) = 5x + 3$, find $f(f(-5))$.",
  "options": null,
  "correctKey": null,
  "correctValue": -107.0,
  "titaTolerance": 0.0,
  "difficulty": "medium",
  "eloRating": 1200.0,
  "solutionMarkdown": "$f(-5) = 5(-5) + 3 = -22$. $f(f(-5)) = f(-22) = 5(-22) + 3 = -107$.",
  "altSolutionMarkdown": null,
  "targetSeconds": 120,
  "source": "generated",
  "sourceRef": null,
  "verification": {
    "method": "sympy_verified",
    "verifiedAt": "2026-08-09T00:00:00Z",
    "selfConsistencyAgreement": null,
    "distractorAuditPassed": null,
    "dedupChecked": null,
    "reviewerNote": null
  },
  "tags": [
    "algebra:functions",
    "composite"
  ]
}
